{
  "schema_version": "harness.waiver.v1",
  "waiver_id": "",
  "work_unit_id": "",
  "waiver_type": "evidence",
  "requested_by": "agent",
  "approved_by": "human:",
  "reason": "",
  "waived_requirement": "",
  "replacement_evidence": [],
  "risk_accepted": "",
  "expires_at": "",
  "created_at": ""
}
